title,price,rating
Blueride 2 Pcs Combo Silicone Soft Cleaning Body Bath Brush With Shampoo Dispenser Plus Back Scrubber Bath Brush Washer For Dead Skin Removal Bath Bod,329,4.2 out of 5 stars
"Pelikas 2 Pcs Combo Silicone Soft Cleaning Body | Bath Brush With Shampoo Dispenser Plus Back Scrubber, Bath Brush Washer For Dead Skin Removal Gentle Massage Exfoliation For Kids Men And Women",319,5.0 out of 5 stars
"ESYA Silicone Bath Body Brush,Exfoliating Long Body Back Scrubber for Shower h Soft Bristles for Men and Women, Improves Blood Circulation, Skin Health",199,5.0 out of 5 stars
"PURE SOUL 2 Pcs Combo Silicone Soft Bath Body Brush with Shampoo Dispenser+ Bath Body Back Brush,Ultra Soft Exfoliating Silicone Body Scrubber Deep Cleaning, Gentle Massage Exfoliation Kids Men Women",0,0
"STOCKHAWKERS PACK OF 2 Silicone Back Scrubber Bath Belt Double-Sided Massage Body Wash Brush Shower Exfoliating Belt Removes Bath Towel, Cleaning Tools for men and women - Multicolor (Pack of 2)",106,3.3 out of 5 stars
"RUDRESHWAR Silicone Bath Body Brush, Bath Brush Scrubber Belt, Bubble Brush, Silicone Soft Cleaning Brush Shampoo Dispenser | Combo of 4 | (Multi Color) (Combo - 4)",0,0
"VAVSU Silicone Back Scrubber Bath Brush Washer For Dead Skin Removal Mens Womens Double Side Brush Belt For Shower Exfoliating Belt, Easy to Clean, Lathers Well (Multicolor) (Body Scrubber)",179,3.8 out of 5 stars
"HU Hub Silicon Massage Bath Brush, Scalp & Bathing Brush For Cleaning Body Silicon Wash Scrubber, Cleaner & Massager For Shampoo, Soap Dispenser Bathing Tool Brushes, Bathroom, Men & Women & Children.",185,4.0 out of 5 stars
COLLAPSIBLE Soft Silicone Bath Brush With Hooks Baby Showers silicon Cleaning Brushes Massage Skin Scrubber Can Fill Shampoo (MULTI COLOUR) (BRUSH),198,2.8 out of 5 stars
Blueride 2 Pcs Combo Silicone Soft Cleaning Body Bath Brush With Shampoo Dispenser Plus Back Scrubber Bath Brush Washer For Dead Skin Removal Bath Bod,329,4.2 out of 5 stars
"JM SELLER Silicone Soft Bath Body Brush with Shampoo Dispenser Scrubber-use in Shower Deep Cleaning Gentle Scrub Massage for Children, Men Women",209,4.5 out of 5 stars
SCRUBBING Soft Silicone Bath Brush With Hooks Baby Showers silicon Cleaning Brushes Massage Skin Scrubber Can Fill Shampoo (MULTI COLOUR) (BRUSH),179,3.3 out of 5 stars
"YOVSO Silicone Back Scrubber Bath Brush Washer For Dead Skin Removal Mens Womens Double Side Brush Belt For Shower Exfoliating Belt, Easy to Clean, Lathers Well (Multicolor) (Body Scrubber)",195,3.6 out of 5 stars
Homeleven Silicone Bubble Bath SPA Super Soft Body Scrubbing Brush Combo Set of 2 Piece,249,3.6 out of 5 stars
"BONDWET Silicone Bath Body Brush, Silicone Back Scrubber for Shower, Silicone Shower Brush With Soft Rubbing Massage Bubble Body Cleaner (Multi Color) (Bath Brush and Shampoo Dispenser)",329,5.0 out of 5 stars
SR TRADERS Silicone Double Side Body Scrubber Bath Brush Dead Skin Removal And Easy Wash For Men And Womens Double Side Brush Back Mud Peeling Body Scrubber Belt (Multicolor),127,4.5 out of 5 stars
COLLAPSIBLE Soft Silicone Bath Brush With Hooks Baby Showers silicon Cleaning Brushes Massage Skin Scrubber Can Fill Shampoo (Pack of 1),189,5.0 out of 5 stars
QBK Silicone Body Scrubber/Bath Body Cleaning Belt/Skin Brush Belt For Skin/Bathing/Body Dirt Removal For Kids Men's & Women Multi color,182,3.7 out of 5 stars
"Silicone Back Scrubber for Shower,TEGOOL New Silicone Bath Body Soft Brush,Easy to Clean Washer More Hygienic Exfoliating (Blue)",198,4.4 out of 5 stars
"AB CLUB Silicone Body Back Scrubber Bath Brush Washer For Dead Skin Removal Mens Womens Double Side Brush Belt For Shower Exfoliating Belt, Easy to Clean, Lathers Well (Multicolor) (Body Scrubber)",169,5.0 out of 5 stars
BEAUTIVIA� 2021 Latest Body Wash Silicone Body Scrubber Belt Double Side Shower Belt Removes Bath Towel Waterproof Easy Foot Cleaner Cleaning Brush Scrubber for baby (Random Color),120,3.5 out of 5 stars
INNERNEED Soft Silicone Body Brush Bath Shower Glove Exfoliating Skin Massage Scrubber Facial Cleaning (Blue),500,4.5 out of 5 stars
Virth™ Soft Silicone Bath Brush/Double Sided Foaming Shower Sponge/Cleaning Body Massage Scrub Gloves For Kids/Baby Bath Tools 14 x 7.5 x 5 (Multicolor/Silicon + Sponge/Pack Of 1Pcs),201,4.5 out of 5 stars
"AOQ Silicone Body Back Scrubber, Double Side Bathing Brush for Skin Deep Cleaning Massage, Dead Skin Removal Exfoliating Belt for Shower, Easy to Clean, for Men & Women",199,3.7 out of 5 stars
"GEUNPA® Rakhi Gift for Brother Bath Brush With Shampoo Dispenser back scrubber for bathing silicon body scrubber for bathing silicon body scrubber for bathing Dead Skin Removal Dead Skin Removal(Multicolor,Combo)",280,5.0 out of 5 stars
"SILICON GEL BATH BRUSH SILICONE BATH BODY BRUSH, EXFOLIATING LONG SILICONE BODY BACK SCRUBBER, BATH & BODY BRUSHES, SHOWER BRUSH, DOUBLE-SIDED BATHING BRUSH FOR SKIN CARE",125,3.4 out of 5 stars
Zoffany Silicone Body Brush belt Scrubber Double Side Back Cleaning Shower Strap for Comfortable Massage Bath TowelBack StrapSilicone Wash Belt Easy to Clean Well for Men & Women (Multicolor),199,3.4 out of 5 stars
YOVSO Silicone Body Back Scrubber Bath Brush Washer for Dead Skin Removal for Men and Women (Multicolour),199,3.4 out of 5 stars
"WORQOID 2 Pcs Combo Silicone Soft Cleaning Body | Bath Brush With Shampoo Dispenser + Back Scrubber, Bath Brush Washer For Dead Skin Removal Gentle Massage Exfoliation Kids Men And Women",314,5.0 out of 5 stars
"RUDRESHWAR Silicone Bath Body Brush, Silicone Back Scrubber for Shower, Silicone Shower Brush With Soft Rubbing Massage Bubble Body Cleaner (Multi Color)",0,0
CLEZORA Silicone Body Scrubber/Bath Body Cleaning Belt/Skin Brush Belt For Skin/Bathing/Body Dirt Removal For Kids Men's & Women Multi color,175,3.5 out of 5 stars
"LOZOX Marketing Silicone Body Back Scrubber Bath Brush Washer For Dead Skin Removal Mens Womens Double Side Brush Belt For Shower Exfoliating Belt, Easy to Clean, Lathers Well (Multicolor) (Body Scrubber)",149,3.7 out of 5 stars
SK Trading Bath Brush Pink Colour SOAP Dispenser Multicolor Silicon Brush,124,5.0 out of 5 stars
"FLYWELL Silicone Bath Body Brush, Bath Brush Scrubber Belt,Silicone Soft Cleaning Brush,Bubbel Brush,Shampoo Dispenser &Leaf Shape Soap Holder. (Multi Color) (Pack Of - 5)",0,0
"Twonzilla 2 Pcs Combo Silicone Body Back Scrubber, Double Side Bathing Brush For Skin Deep Cleaning Massage, Dead Skin Removal Exfoliating Belt For Shower, Easy To Clean,body Brush For Bathing / Silicone Body Scrubber And Bath Brush with Soap Dispenser | Bath Body Cleaning Belt | Skin Brush Belt For Skin | Bathing |For Kids Men And Women [ Multi Color ]",309,5.0 out of 5 stars
"Shayonam [2 Pcs Combo] Silicone Body Back Scrubber, Double Side Bathing Brush For Skin Deep Cleaning Massage, Dead Skin Removal Exfoliating Belt For Shower, Easy To Clean,body Brush For Bathing",329,3.7 out of 5 stars
Ronest body scrubber belt bath brush silicone scrub back skin shower double exfoliating massager long cleaning easy side clean lathers for men & women,0,0
SK Trading Bath Brush Pink Colour SOAP Dispenser Multicolor Silicon BRUSH11,0,0
Children's joy - Silicone Bath Body Brush Exfoliating Double Side Silicone Body Back Scrubber Belt Long Back Cleaning Shower Strap for Men Women,0,0
"MUSIK Bath Shower Silicone Body Brush, Bath Belt Exfoliating Body Brush Belt Wash, Washing Towel Scrub Sponges, Washcloth Bathroom Accessories - for Men",0,0
"ZENUSS® Silicone Body Back Scrubber Bath Brush Washer for Dead Skin Body Cleaning Scrubber Shower Brush, Bath Body Scrubber, Gel Bath Towel Shower Strap Deep Clean & Massage (Multicolor)",0,0
Jiya Enterprise Silicone Back Scrubber Belt Soft Body Massage Cleaning Exfoliating Bath Brush(Assorted Colour),175,3.8 out of 5 stars
"T TOPLINE COMBO Silicone Bath Body Back Scrubber Brush+Silicone Shower Brush with Soap Dispenser, Bath & Body Brushes, Shower Brush, Double-sided Brush",249,3.6 out of 5 stars
HEALLILY Infant Silicone Face Cleansing Brush Baby Bath Brush Silicone Face Scrubbers Exfoliator Brush Silicone Scrubbers Exfoliator Brush Exfoliator Face Cleansing Pads,0,0
"MK BROTHERS™ Silicone Body Back Scrubber, Double Side Bathing Brush for Skin Deep Cleaning Massage, Dead Skin Removal Exfoliating Belt for Shower, for Men & Women (Multicolor)",0,0
Silicon Bathing Brush for Body and Scalp | Ultra Soft Bristles Liquid Soap Dispenser | Deep Skin Cleanser and Exfoliator | Perfect Scrubber Cleaner and Body Wash Dispenser | Men and Women- RX1476,155,5.0 out of 5 stars
"Afflatus Silicone Back Scrubber Bath Brush Washer For Dead Skin Removal Mens Womens Double Side Brush Belt For Shower Exfoliating Belt, Easy to Clean, Lathers Well (Multicolor) (Body Scrubber) (Belt)",199,4.1 out of 5 stars
"PURE SOUL 2 Pcs Combo Silicone Soft Bath Body Brush with Shampoo Dispenser+ Bath Body Back Brush,Ultra Soft Exfoliating Silicone Body Scrubber Deep Cleaning, Gentle Massage Exfoliation Kids Men Women",0,0
"HOTFIX® Silicon Massage Bath Brush Hair, Scalp & Bathing Brush For Cleaning Body | Silicon Wash Scrubber, Cleaner & Massager For Shampoo, Soap Dispenser | Bathing Tool | Brushes, Bathroom, Men & Women",159,3.1 out of 5 stars
"NUTEN Bath Scrubber Silicone Body Back Scrubber Bath Brush Washer For Dead Skin Removal Mens Womens Double Side Brush Belt For Shower Exfoliating Belt, Easy to Clean, Lathers Well (Body Scrubber)",149,4.0 out of 5 stars
"FLYWELL Silicone Bath Brush, Body Brush, Bath Brush Scrubber Belt, Bubble Brush,Leaf Shoap Stand.(Multi Color) Pack Of - 4",349,2.5 out of 5 stars
"VAVSU Silicone Body Back Scrubber, Double Side Bathing Brush for Skin Deep Cleaning Massage, Dead Skin Removal Exfoliating Belt for Shower, for Men & Women (Multicolor)",169,3.9 out of 5 stars
AHKIS 2 Pcs Combo Silicone Soft Bath Body Brush with Shampoo Dispenser Back Brush Ultra Exfoliating Scrubber Deep Cleaning Gentle Massage Exfoliation Kids Men Women use in Shower Scrub,349,3.0 out of 5 stars
Anva 2 Pcs Combo Silicone Soft Bath Body Brush with Shampoo Dispenser Back Scrubber Deep Cleaning Gentle Massage Exfoliation Kids Men Women use in Shower Scrub (Multicolor),299,3.7 out of 5 stars
Airah Beauty Silicone Bath Body Brush Scrubber | Reusable bath sponge bathing Scalp Massage Brush | Color Will Send As Per Product Availability,123,4.0 out of 5 stars
"NH Enterprise Silicone Bath Body Brush,Exfoliating Long Body Back Scrubber for Shower h Soft Bristles for Men and Women, Improves Blood Circulation, Skin Health",199,4.3 out of 5 stars
"Bath brush [2 Pcs Combo] Silicone Body Back Scrubber, Double Side Bathing Brush For Skin Deep Cleaning Massage, Dead Skin Removal Exfoliating Belt For Shower, Easy To Clean,body Brush For Bathing",249,4.3 out of 5 stars
Vega Cellulite Bristle Bath Brush,484,4.0 out of 5 stars
"WBQ Silicone Body Back Scrubber, Double Side Bathing Brush for Skin Deep Cleaning Massage, Dead Skin Removal Exfoliating Belt for Shower, Easy to Clean, for Men & Women",199,3.6 out of 5 stars
"BATH BRUSH Silicone Body Back Scrubber, Double Side Bathing Brush for Skin Deep Cleaning Massage",199,3.2 out of 5 stars
